### ISSUE TITLE
tun mode does not seem work

### ISSUE THREAD

**Issue by sem-hub** [apernet/hysteria#1049]
I have working sock5 config. I've added simple tun configuration into the config file:
```yaml
tun:
   name: tun0
```

tun0 is created and looks like this:

```
62: tun0: <POINTOPOINT,MULTICAST,NOARP,UP,LOWER_UP> mtu 1500 qdisc fq state UNKNOWN group default qlen 500
    link/none 
    inet 100.100.100.101/30 brd 100.100.100.103 scope global tun0
       valid_lft forever preferred_lft forever
    inet6 2001::ffff:ffff:ffff:fff1/126 scope global 
       valid_lft forever preferred_lft forever
    inet6 fe80::3d97:c622:bc56:acb8/64 scope link stable-privacy 
       valid_lft forever preferred_lft forever
```

I routed my client into tun0 interface and look at tcpdump output. It looks strange:

```
23:47:52.341311 IP 10.1.2.3.38940 > 5.61.236.232.443: Flags [S], seq 3388209320, win 65535, options [mss 1344,sackOK,TS val 83802990 ecr 0,nop,wscale 9], length 0
23:47:52.341434 IP 100.100.100.102.10002 > 100.100.100.101.34973: Flags [S], seq 3388209320, win 65535, options [mss 1344,sackOK,TS val 83802990 ecr 0,nop,wscale 9], length 0
```

It just copy client packet with tun0 interface IP.  There are no answers. 
Both client and server have verion 4.2.1. Built from sources. Ubuntu 22.04.4 on both sides.
I did not forget about this:

```
sysctl net.ipv4.conf.default.rp_filter=2
sysctl net.ipv4.conf.all.rp_filter=2
```

**Comment by haruue** [comment]
Hello,

Please put your server IP address in `tun.route.ipv4Exclude`.

For example, if your server address is `192.0.2.233`

```yaml
tun:
  name: tun0
  route:
    ipv4Exclude: [192.0.2.233/32]
```

**Comment by haruue** [comment]
The IP address of your Hysteria server (the one after the `server:` in the client config, resolve it to IP address if it is a domain) should be there. It will NOT be `100.100.100.102`.

Please take a look at our document for details:
https://hysteria.network/docs/advanced/Full-Client-Config/#tun

**Comment by sem-hub** [comment]
Sure, I put my server IP in config. My current config is:

auth: XXX
server: 1.1.1.1:443
lazy: false
tls:
  ca: /hysteria2/ca.cer
  insecure: 'false'
  sni: mysni
socks5:
  listen: 127.0.0.1:2080
tun:
  name: 'tun0'
  ipv4: 100.100.100.101/30
  ipv6: 2001::ffff:ffff:ffff:fff1/126
  route:
    ipv4Exclude: [1.1.1.1/32]
    ipv6Exclude: ["1111:1111::1/128"]

1.1.1.1 - is my server IP. socks works fine with this config, but tun does not.
I run curl -4v ifconfig.me
tcpdump -ni tun0 shows UDP works good:
01:01:54.881389 IP 100.100.100.101.25235 > 216.239.38.110.53: 19241% [1au] A? ifconfig.me. (40)
01:01:54.881487 IP 100.100.100.101.22167 > 216.239.32.110.53: 41689% [1au] AAAA? ifconfig.me. (40)

 but all TCP packet just duplicated with other IPs:

00:52:42.010122 IP 100.100.100.101.56280 > 184.51.252.176.80: Flags [S], seq 1296558909, win 43520, options [mss 1360,sackOK,TS val 3207448490 ecr 0,nop,wscale 11], length 0
00:52:42.010181 IP 100.100.100.102.10003 > 100.100.100.101.40467: Flags [S], seq 1296558909, win 43520, options [mss 1360,sackOK,TS val 3207448490 ecr 0,nop,wscale 11], length 0

**Comment by haruue** [comment]
> but all TCP packet just duplicated with other IPs

That's how it works.

> socks works fine with this config, but tun does not.

Please set the `HYSTERIA_LOG_LEVEL=debug` environment variable on the client side, try again and paste the logs here.

**Comment by sem-hub** [comment]
Ah, OK. I thought it was a problem and dig wrong way.
Now I flushed all my iptables rules and tried again. It works now. Sorry for disturbing.
