### ISSUE TITLE
客户端连接报错，换了两个VPS，一个日本一个美国。同样的端口tuic就可以正常连接，hysteria就连接不上。

### ISSUE THREAD

**Issue by evevil** [apernet/hysteria#846]
客户端连接报错：FATAL   failed to initialize client     {"error": "connect error: timeout: no recent network activity"}
我有两个VPS地址，一个在日本一个在美国。
Server 端配置如下：
listen: :39

tls:
  cert: /opt/apps/www.23wwe.co.crt
  key: /opt/apps/www.23wwe.co.key

obfs:
  type: salamander
  salamander:
    password: e3828bfb

quic:
  initStreamReceiveWindow: 16777216
  maxStreamReceiveWindow: 16777216
  initConnReceiveWindow: 33554432
  maxConnReceiveWindow: 33554432

auth:
  type: password
  password: e3828bfb

masquerade:
  type: proxy
  proxy:
    url: https://maimai.sega.jp
    rewriteHost: true

客户端配置如下：
server: xx.xx.xx.xx:39,10000-65535

auth: e3828bfb

tls:
  sni: www.23wwe.co
  insecure: true

obfs:
  type: salamander
  salamander:
    password: e3828bfb

quic:
  initStreamReceiveWindow: 16777216
  maxStreamReceiveWindow: 16777216
  initConnReceiveWindow: 33554432
  maxConnReceiveWindow: 33554432

fastOpen: true

socks5:
  listen: 127.0.0.1:5080

http:
  listen: 127.0.0.1:8080

transport:
  udp:
    hopInterval: 30s

利用netcat和socat 探测服务端IP和端口可以正常连接：
root@admin:/opt/apps# socat -ddd - UDP:www.23wwe.co:39
2023/11/29 15:59:34 socat[9613] I socat by Gerhard Rieger and contributors - see www.dest-unreach.org
2023/11/29 15:59:34 socat[9613] I This product includes software developed by the OpenSSL Project for use in the OpenSSL Toolkit. (http://www.openssl.org/)
2023/11/29 15:59:34 socat[9613] I This product includes software written by Tim Hudson (tjh@cryptsoft.com)
2023/11/29 15:59:34 socat[9613] N reading from and writing to stdio
2023/11/29 15:59:34 socat[9613] N opening connection to AF=2 www.23wwe.co:39
2023/11/29 15:59:34 socat[9613] I starting connect loop
2023/11/29 15:59:34 socat[9613] I socket(2, 2, 17) -> 5
2023/11/29 15:59:34 socat[9613] N successfully connected from local address AF=2 192.168.10.147:36153
2023/11/29 15:59:34 socat[9613] I resolved and opened all sock addresses
2023/11/29 15:59:34 socat[9613] N starting data transfer loop with FDs [0,1] and [5,5]

root@admin:/opt/apps# nc -uvz www.23wwe.co 39
Connection to 148.135.127.50 39 port [udp/*] succeeded!

在服务端用tcpdump抓包的情况下：
用hysteria客户端模式进行连接，tcpdump抓不到包！

但是用socat和netcat访问服务端端口的情况下可以正常用tcpdump抓到网络包：
[root@hysteria hy]# tcpdump -i eth0 udp port 39 -XX
dropped privs to tcpdump
tcpdump: verbose output suppressed, use -v[v]... for full protocol decode
listening on eth0, link-type EN10MB (Ethernet), snapshot length 262144 bytes
13:29:05.058771 IP 117.xx.xx.xx.33905 > hysteria.rlp: UDP, length 1
        0x0000:  0016 3e0f 82e9 002a 6aa4 8cc1 0800 4500  ..>....*j.....E.
        0x0010:  001d 2535 4000 2f11 188c 756b 84ea 9487  ..%5@./...uk....
        0x0020:  7f32 8471 0027 0009 1534 5800 0000 0000  .2.q.'...4X.....
        0x0030:  0000 0000 0000 0000 0000 0000            ............
13:29:05.058774 IP 117.xx.xx.xx.33905 > hysteria.rlp: UDP, length 1
        0x0000:  0016 3e0f 82e9 002a 6aa4 8cc1 0800 4500  ..>....*j.....E.
        0x0010:  001d 2536 4000 2f11 188b 756b 84ea 9487  ..%6@./...uk....
        0x0020:  7f32 8471 0027 0009 1534 5800 0000 0000  .2.q.'...4X.....
        0x0030:  0000 0000 0000 0000 0000 0000            ............
13:29:06.058943 IP 117.xx.xx.xx.33905 > hysteria.rlp: UDP, length 1
        0x0000:  0016 3e0f 82e9 002a 6aa4 8cc1 0800 4500  ..>....*j.....E.
        0x0010:  001d 2537 4000 2f11 188a 756b 84ea 9487  ..%7@./...uk....
        0x0020:  7f32 8471 0027 0009 1534 5800 0000 0000  .2.q.'...4X.....
        0x0030:  0000 0000 0000 0000 0000 0000            ............
13:29:07.059267 IP 117.xx.xx.xx.33905 > hysteria.rlp: UDP, length 1
        0x0000:  0016 3e0f 82e9 002a 6aa4 8cc1 0800 4500  ..>....*j.....E.
        0x0010:  001d 2538 4000 2f11 1889 756b 84ea 9487  ..%8@./...uk....
        0x0020:  7f32 8471 0027 0009 1534 5800 0000 0000  .2.q.'...4X.....
        0x0030:  0000 0000 0000 0000 0000 0000            ............

请帮忙看一下是哪里有问题？
而且同样的服务器地址和端口，通过tuic进行访问就可以正常连接和使用。

**Comment by tobyxdd** [comment]
确定你的端口跳跃在服务端配置好了？不用端口跳跃呢

**Comment by tobyxdd** [comment]
> 我也遇到了同樣的情形，但是是在openwrt上嘗試的。具體表現爲連線十分不穩定，並且程式經常崩潰，而且捕獲不到任何數據包。

这不叫同样情形
